Query_Str,Post_URL,Author_Name,Author_Web_Page_URL,Author_Handle,Verified_Status,UTC_Time,Ads,Tweet_Content,Post_ID,Tweet_URL,Reply_Count,Repost_Count,Like_Count,View_Count,Bookmark_Count,Tweet_Image_URL,Replying_to,Reply_to_Whom,Reply_to_Whom_URL,Reply_to_Whom_Username,Reply_to_Whom_Handle,Language,Type
"""\""Donald Trump\"""" Trump OR DonaldTrump OR DJT OR MAGA ##DonaldTrump OR ##Trump2024 OR ##MAGA min_faves:0","https://x.com/search?q=""\""Donald Trump\"""" Trump OR DonaldTrump OR DJT OR MAGA ##DonaldTrump OR ##Trump2024 OR ##MAGA min_faves:0 lang:en until:2024-11-05 since:2024-11-04&src=typed_query",Rafael Romo,https://x.com/RafaelRomoCNN,RafaelRomoCNN,False,2024-11-04 20:09:46+00:00,False,"Donald Trump threatens Mexican President @Claudiashein with tariffs of as much as 100% if Mexico doesn't stop ""this onslaught of criminals and drugs coming into our country."" #DonaldTrump #ClaudiaSheinbaum #Mexico #Tariffs",1853530098215109098,https://x.com/RafaelRomoCNN/status/1853530098215109098,3,9,8,5753,0,https://pbs.twimg.com/ext_tw_video_thumb/1853530031365951488/pu/img/WjHslmgmTo20lrq_.jpg,False,,,,,en,Top
"""\""Donald Trump\"""" Trump OR DonaldTrump OR DJT OR MAGA ##DonaldTrump OR ##Trump2024 OR ##MAGA min_faves:0","https://x.com/search?q=""\""Donald Trump\"""" Trump OR DonaldTrump OR DJT OR MAGA ##DonaldTrump OR ##Trump2024 OR ##MAGA min_faves:0 lang:en until:2024-11-05 since:2024-11-04&src=typed_query",MJ,https://x.com/Real_Politik101,Real_Politik101,True,2024-11-04 22:48:22+00:00,False,I have just proudly voted for PRESIDENT DONALD J TRUMP. A honor I have such an opportunity. WE WILL WIN. #TRUMP2024,1853570008817004701,https://x.com/Real_Politik101/status/1853570008817004701,1,3,19,2808,2,https://pbs.twimg.com/amplify_video_thumb/1853569943599828992/img/bD7a9hMcRSsyqgd9.jpg,False,,,,,en,Top
"""\""Donald Trump\"""" Trump OR DonaldTrump OR DJT OR MAGA ##DonaldTrump OR ##Trump2024 OR ##MAGA min_faves:0","https://x.com/search?q=""\""Donald Trump\"""" Trump OR DonaldTrump OR DJT OR MAGA ##DonaldTrump OR ##Trump2024 OR ##MAGA min_faves:0 lang:en until:2024-11-05 since:2024-11-04&src=typed_query",Dal Khalsa UK 🇬🇧🏴󠁧󠁢󠁥󠁮󠁧󠁿 🦅🇺🇸,https://x.com/DalKhalsaUK,DalKhalsaUK,True,2024-11-04 23:48:03+00:00,False,"We support President Donald J. Trump @realdonaldtrump &amp; appeal to all who can vote to vote in tremendous numbers tomorrow. This is the most IMPORTANT election in world history , the fate of Western Civilisation &amp; the very future of humanity depends on it. #MAGA #TRUMP2024",1853585027897892981,https://x.com/DalKhalsaUK/status/1853585027897892981,1,3,11,406,1,https://pbs.twimg.com/amplify_video_thumb/1853584939511369728/img/4f-lxhRtwnXGkPY-.jpg,False,,,,,en,Top
"""\""Donald Trump\"""" Trump OR DonaldTrump OR DJT OR MAGA ##DonaldTrump OR ##Trump2024 OR ##MAGA min_faves:0","https://x.com/search?q=""\""Donald Trump\"""" Trump OR DonaldTrump OR DJT OR MAGA ##DonaldTrump OR ##Trump2024 OR ##MAGA min_faves:0 lang:en until:2024-11-05 since:2024-11-04&src=typed_query",Nicholas Lissack,https://x.com/NicholasLissack,NicholasLissack,True,2024-11-04 18:06:01+00:00,False,"While my support for Trump has been no secret, I’ve kept my final prediction under wraps—until now. Here’s what I believe the outcome will be. And if you haven’t voted yet, get out there and do it! Donald Trump wins! #Trump2024 #MAGA",1853498954089918881,https://x.com/NicholasLissack/status/1853498954089918881,21,14,157,11861,10,https://pbs.twimg.com/media/GbjzR1qWMAA3ITK.jpg,False,,,,,en,Top
"""\""Donald Trump\"""" Trump OR DonaldTrump OR DJT OR MAGA ##DonaldTrump OR ##Trump2024 OR ##MAGA min_faves:0","https://x.com/search?q=""\""Donald Trump\"""" Trump OR DonaldTrump OR DJT OR MAGA ##DonaldTrump OR ##Trump2024 OR ##MAGA min_faves:0 lang:en until:2024-11-05 since:2024-11-04&src=typed_query",Sapiential Sage,https://x.com/Sapiential_Sage,Sapiential_Sage,False,2024-11-04 19:57:30+00:00,False,"Doing my part to support @realDonaldTrump in the final stretch! I'm not a pro, but I hope you’ll appreciate this video. Let’s prevent WWIII—vote for Donald Trump tomorrow!🇺🇸 #Trump2024 #MAGA2024 #Kamala_is_a_war_Criminal",1853527010062090283,https://x.com/Sapiential_Sage/status/1853527010062090283,5,7,12,2802,0,https://pbs.twimg.com/ext_tw_video_thumb/1853526193288384512/pu/img/D4HrYV0LCs2DKsmd.jpg,False,,,,,en,Top
"""\""Donald Trump\"""" Trump OR DonaldTrump OR DJT OR MAGA ##DonaldTrump OR ##Trump2024 OR ##MAGA min_faves:0","https://x.com/search?q=""\""Donald Trump\"""" Trump OR DonaldTrump OR DJT OR MAGA ##DonaldTrump OR ##Trump2024 OR ##MAGA min_faves:0 lang:en until:2024-11-05 since:2024-11-04&src=typed_query",Toxic ☣️,https://x.com/ToxicLakers,ToxicLakers,True,2024-11-04 23:25:31+00:00,False,ToxicLakers is officially endorsing Donald Trump #MAGA,1853579357790646386,https://x.com/ToxicLakers/status/1853579357790646386,20,3,111,5601,1,https://pbs.twimg.com/media/Gbk8mc8WAAAoeb0.jpg;https://pbs.twimg.com/media/Gbk8mc9XwAAGZQy.jpg,False,,,,,en,Top
"""\""Donald Trump\"""" Trump OR DonaldTrump OR DJT OR MAGA ##DonaldTrump OR ##Trump2024 OR ##MAGA min_faves:0","https://x.com/search?q=""\""Donald Trump\"""" Trump OR DonaldTrump OR DJT OR MAGA ##DonaldTrump OR ##Trump2024 OR ##MAGA min_faves:0 lang:en until:2024-11-05 since:2024-11-04&src=typed_query",Firing Line with Margaret Hoover,https://x.com/FiringLineShow,FiringLineShow,True,2024-11-04 19:30:00+00:00,False,"Former National Security Advisor @LTGHRMcMaster discusses the ""fragility"" of #DonaldTrump's ego. ""One of the ways that people would try to manipulate Donald Trump was they would say, ‘This will make you look weak,’ or ‘This will alienate your base.’"" http://bit.ly/3YO0HBa",1853520087690490111,https://x.com/FiringLineShow/status/1853520087690490111,0,1,3,1661,1,https://pbs.twimg.com/media/GbVyncBWwAAZBSA.jpg,False,,,,,en,Top
"""\""Donald Trump\"""" Trump OR DonaldTrump OR DJT OR MAGA ##DonaldTrump OR ##Trump2024 OR ##MAGA min_faves:0","https://x.com/search?q=""\""Donald Trump\"""" Trump OR DonaldTrump OR DJT OR MAGA ##DonaldTrump OR ##Trump2024 OR ##MAGA min_faves:0 lang:en until:2024-11-05 since:2024-11-04&src=typed_query",The Reform Daily,https://x.com/ReformDaily_,ReformDaily_,True,2024-11-04 23:42:16+00:00,False,"⚡️”Big energy!”⚡️ Nigel Farage is uniting with the U.S. at the Trump rally, championing a strong partnership and support for Donald Trump. #Trump2024 #Farage #ReformUK #BigEnergy #USUKAlliance #Election2024 #TransatlanticRelations",1853583572424167804,https://x.com/ReformDaily_/status/1853583572424167804,8,83,281,4998,2,https://pbs.twimg.com/amplify_video_thumb/1853581426551132160/img/gkQo_4iIUlLj0HQ1.jpg,False,,,,,en,Top
"""\""Donald Trump\"""" Trump OR DonaldTrump OR DJT OR MAGA ##DonaldTrump OR ##Trump2024 OR ##MAGA min_faves:0","https://x.com/search?q=""\""Donald Trump\"""" Trump OR DonaldTrump OR DJT OR MAGA ##DonaldTrump OR ##Trump2024 OR ##MAGA min_faves:0 lang:en until:2024-11-05 since:2024-11-04&src=typed_query",Donald Trump Rune,https://x.com/Runedonaldtrump,Runedonaldtrump,False,2024-11-04 17:02:18+00:00,False,He’s coming for the establishment. It’s time to finish what he started. #MAGA THE•DONALD•TRUMP,1853482919710343475,https://x.com/Runedonaldtrump/status/1853482919710343475,2,10,32,624,0,https://pbs.twimg.com/media/Gbjk5KSW8AAJXgO.jpg,False,,,,,en,Top
"""\""Donald Trump\"""" Trump OR DonaldTrump OR DJT OR MAGA ##DonaldTrump OR ##Trump2024 OR ##MAGA min_faves:0","https://x.com/search?q=""\""Donald Trump\"""" Trump OR DonaldTrump OR DJT OR MAGA ##DonaldTrump OR ##Trump2024 OR ##MAGA min_faves:0 lang:en until:2024-11-05 since:2024-11-04&src=typed_query",The Reform Daily,https://x.com/ReformDaily_,ReformDaily_,True,2024-11-04 20:25:06+00:00,False,🇺🇸 “I am absolutely certain that Donald Trump is going to win the US election.” 💪🏼 Nigel Farage shares an update on his plans in America with just one day to go until the US election. #ReformUK #NigelFarage #Trump2024 #USElection2024 #AmericaDecides,1853533954994782449,https://x.com/ReformDaily_/status/1853533954994782449,4,56,248,5583,2,https://pbs.twimg.com/amplify_video_thumb/1853528059401355264/img/QnLvkPfENK40pipw.jpg,False,,,,,en,Top
"""\""Donald Trump\"""" Trump OR DonaldTrump OR DJT OR MAGA ##DonaldTrump OR ##Trump2024 OR ##MAGA min_faves:0","https://x.com/search?q=""\""Donald Trump\"""" Trump OR DonaldTrump OR DJT OR MAGA ##DonaldTrump OR ##Trump2024 OR ##MAGA min_faves:0 lang:en until:2024-11-05 since:2024-11-04&src=typed_query",𝙬𝙞𝙡𝙡,https://x.com/gradeycook,gradeycook,False,2024-11-04 18:53:05+00:00,False,rowanjcook is officially endorsing Donald J Trump. #MAGA🇺🇸,1853510799500730701,https://x.com/gradeycook/status/1853510799500730701,3,2,14,875,0,https://pbs.twimg.com/media/Gbj-P5uXcAAKcQ4.jpg;https://pbs.twimg.com/media/Gbj-P6eXQAAK0Q5.jpg,False,,,,,en,Top
"""\""Donald Trump\"""" Trump OR DonaldTrump OR DJT OR MAGA ##DonaldTrump OR ##Trump2024 OR ##MAGA min_faves:0","https://x.com/search?q=""\""Donald Trump\"""" Trump OR DonaldTrump OR DJT OR MAGA ##DonaldTrump OR ##Trump2024 OR ##MAGA min_faves:0 lang:en until:2024-11-05 since:2024-11-04&src=typed_query",Rose 🇧🇷🇮🇱🇺🇲🇮🇹🫡,https://x.com/RoseBacellar,RoseBacellar,True,2024-11-04 21:04:57+00:00,False,"Men, get a move on! Get your asses off the couch and vote for Donald Trump! #Maga @realDonaldTrump .",1853543981923086402,https://x.com/RoseBacellar/status/1853543981923086402,3,5,31,1355,0,https://pbs.twimg.com/tweet_video_thumb/GbkcbIAX0AAktYc.jpg,False,,,,,en,Top
"""\""Donald Trump\"""" Trump OR DonaldTrump OR DJT OR MAGA ##DonaldTrump OR ##Trump2024 OR ##MAGA min_faves:0","https://x.com/search?q=""\""Donald Trump\"""" Trump OR DonaldTrump OR DJT OR MAGA ##DonaldTrump OR ##Trump2024 OR ##MAGA min_faves:0 lang:en until:2024-11-05 since:2024-11-04&src=typed_query",Angel Sicily 🇺🇸,https://x.com/sicily_angel,sicily_angel,True,2024-11-04 15:56:59+00:00,False,"Good morning, now go out and vote for Donald J Trump! #TrumpVance2024ToSaveAmerica #MAGA 🇺🇸🇺🇸🇺🇸🇺🇸🇺🇸🇺🇸🇺🇸",1853466479888322933,https://x.com/sicily_angel/status/1853466479888322933,5,2,18,172,0,https://pbs.twimg.com/media/GbjV8DAXIAALrd0.jpg,False,,,,,en,Top
"""\""Donald Trump\"""" Trump OR DonaldTrump OR DJT OR MAGA ##DonaldTrump OR ##Trump2024 OR ##MAGA min_faves:0","https://x.com/search?q=""\""Donald Trump\"""" Trump OR DonaldTrump OR DJT OR MAGA ##DonaldTrump OR ##Trump2024 OR ##MAGA min_faves:0 lang:en until:2024-11-05 since:2024-11-04&src=typed_query",Ole Murica,https://x.com/OleMurica,OleMurica,True,2024-11-04 22:39:44+00:00,False,This is the BIGGEST Election in American History Donald Trump LITERALLY took a Bullet for you The very least you can do is give him your vote Be a #PATRIOT this #Election2024 Vote TRUMP! 🇺🇸 #Trump2024 🇺🇸,1853567835236090257,https://x.com/OleMurica/status/1853567835236090257,6,22,117,9761,2,https://pbs.twimg.com/media/GbkyH1OWAAAVS4B.jpg,False,,,,,en,Top
"""\""Donald Trump\"""" Trump OR DonaldTrump OR DJT OR MAGA ##DonaldTrump OR ##Trump2024 OR ##MAGA min_faves:0","https://x.com/search?q=""\""Donald Trump\"""" Trump OR DonaldTrump OR DJT OR MAGA ##DonaldTrump OR ##Trump2024 OR ##MAGA min_faves:0 lang:en until:2024-11-05 since:2024-11-04&src=typed_query",BITCOINLFG®,https://x.com/bitcoinlfgo,bitcoinlfgo,True,2024-11-04 19:27:58+00:00,False,JUST IN: Donald Trump takes the lead in key battleground states! America is ready to #MAGA again. 🇺🇸 #Election2024 #TrumpVictory,1853519575935058250,https://x.com/bitcoinlfgo/status/1853519575935058250,29,103,724,18708,5,https://pbs.twimg.com/media/GbkGO12bAAA_o_T.jpg,False,,,,,en,Top
"""\""Donald Trump\"""" Trump OR DonaldTrump OR DJT OR MAGA ##DonaldTrump OR ##Trump2024 OR ##MAGA min_faves:0","https://x.com/search?q=""\""Donald Trump\"""" Trump OR DonaldTrump OR DJT OR MAGA ##DonaldTrump OR ##Trump2024 OR ##MAGA min_faves:0 lang:en until:2024-11-05 since:2024-11-04&src=typed_query",FactCheck.org,https://x.com/factcheckdotorg,factcheckdotorg,True,2024-11-04 20:49:25+00:00,False,Donald Trump’s Closing Arguments: Crime/Guns Full story here: https://www.factcheck.org/2024/10/donald-trumps-closing-arguments/ #KamalaHarris #DonaldTrump #Election2024 #factcheck,1853540074732101868,https://x.com/factcheckdotorg/status/1853540074732101868,1,2,4,2986,0,https://pbs.twimg.com/media/GbkYwnqW4AAuBYK.jpg,False,,,,,en,Top
"""\""Donald Trump\"""" Trump OR DonaldTrump OR DJT OR MAGA ##DonaldTrump OR ##Trump2024 OR ##MAGA min_faves:0","https://x.com/search?q=""\""Donald Trump\"""" Trump OR DonaldTrump OR DJT OR MAGA ##DonaldTrump OR ##Trump2024 OR ##MAGA min_faves:0 lang:en until:2024-11-05 since:2024-11-04&src=typed_query",KellyCurrie45,https://x.com/KaCurrie_45,KaCurrie_45,True,2024-11-04 19:36:20+00:00,False,I’m voting for Donald Trump who will #MAGA and keep our pets safe! 🙋🏻‍♀️ if you’re with me!!!!,1853521682260209857,https://x.com/KaCurrie_45/status/1853521682260209857,4,14,24,550,0,https://pbs.twimg.com/media/GbkIJSfawAAnd2Q.jpg;https://pbs.twimg.com/media/GbkIJScaIAEDO9K.jpg,False,,,,,en,Top
"""\""Donald Trump\"""" Trump OR DonaldTrump OR DJT OR MAGA ##DonaldTrump OR ##Trump2024 OR ##MAGA min_faves:0","https://x.com/search?q=""\""Donald Trump\"""" Trump OR DonaldTrump OR DJT OR MAGA ##DonaldTrump OR ##Trump2024 OR ##MAGA min_faves:0 lang:en until:2024-11-05 since:2024-11-04&src=typed_query",i,https://x.com/Miksiddiqui,Miksiddiqui,True,2024-11-04 21:54:25+00:00,False,Trump or Harris ??? Hit Like for Kamala Harris And Retweet for Donald Trump #USElection2024 #DonaldTrump #KamalaHarris #TrumpvsHarris,1853556430214680974,https://x.com/Miksiddiqui/status/1853556430214680974,1,1,3,1371,0,https://pbs.twimg.com/media/Gbknv5vWQAAtsnK.jpg,False,,,,,en,Top
"""\""Donald Trump\"""" Trump OR DonaldTrump OR DJT OR MAGA ##DonaldTrump OR ##Trump2024 OR ##MAGA min_faves:0","https://x.com/search?q=""\""Donald Trump\"""" Trump OR DonaldTrump OR DJT OR MAGA ##DonaldTrump OR ##Trump2024 OR ##MAGA min_faves:0 lang:en until:2024-11-05 since:2024-11-04&src=typed_query",Dean Blundell🇨🇦,https://x.com/ItsDeanBlundell,ItsDeanBlundell,True,2024-11-04 14:52:42+00:00,False,Dude has endorsed Donald Trump publicly 100 times. Thats what this is. A little nod to #Maga.,1853450303309242515,https://x.com/ItsDeanBlundell/status/1853450303309242515,18,26,102,5606,0,,False,,,,,en,Top
"""\""Donald Trump\"""" Trump OR DonaldTrump OR DJT OR MAGA ##DonaldTrump OR ##Trump2024 OR ##MAGA min_faves:0","https://x.com/search?q=""\""Donald Trump\"""" Trump OR DonaldTrump OR DJT OR MAGA ##DonaldTrump OR ##Trump2024 OR ##MAGA min_faves:0 lang:en until:2024-11-05 since:2024-11-04&src=typed_query",FactCheck.org,https://x.com/factcheckdotorg,factcheckdotorg,True,2024-11-04 20:49:26+00:00,False,Donald Trump’s Closing Arguments: Crime/Guns Full story here: https://www.factcheck.org/2024/10/donald-trumps-closing-arguments/ #KamalaHarris #DonaldTrump #Election2024 #factcheck,1853540076757627248,https://x.com/factcheckdotorg/status/1853540076757627248,0,4,5,2854,0,https://pbs.twimg.com/media/GbkY0vJWsAAA-93.png;https://pbs.twimg.com/ext_tw_video_thumb/1853540015906734080/pu/img/WaWdwQ0ngpy3aK0a.jpg;https://pbs.twimg.com/ext_tw_video_thumb/1853540015919316992/pu/img/QoSYL3F5nR_mBTKc.jpg;https://pbs.twimg.com/ext_tw_video_thumb/1853540015935995904/pu/img/zQCP1_CanxtYxOY4.jpg,True,factcheckdotorg,https://x.com/factcheckdotorg,,factcheckdotorg,en,Top
"""\""Donald Trump\"""" Trump OR DonaldTrump OR DJT OR MAGA ##DonaldTrump OR ##Trump2024 OR ##MAGA min_faves:0","https://x.com/search?q=""\""Donald Trump\"""" Trump OR DonaldTrump OR DJT OR MAGA ##DonaldTrump OR ##Trump2024 OR ##MAGA min_faves:0 lang:en until:2024-11-05 since:2024-11-04&src=typed_query",Hunter Muse,https://x.com/Huntymuse,Huntymuse,True,2024-11-04 18:21:46+00:00,False,LeVert Muse is officially endorsing Donald J Trump #MAGA 🇺🇸,1853502916016914645,https://x.com/Huntymuse/status/1853502916016914645,47,25,924,35567,10,https://pbs.twimg.com/media/Gbj3FDyWcAE0cvF.jpg;https://pbs.twimg.com/media/Gbj3FF2XQAA9Y4z.jpg,False,,,,,en,Top
"""\""Donald Trump\"""" Trump OR DonaldTrump OR DJT OR MAGA ##DonaldTrump OR ##Trump2024 OR ##MAGA min_faves:0","https://x.com/search?q=""\""Donald Trump\"""" Trump OR DonaldTrump OR DJT OR MAGA ##DonaldTrump OR ##Trump2024 OR ##MAGA min_faves:0 lang:en until:2024-11-05 since:2024-11-04&src=typed_query",Dr. CZ,https://x.com/AngelMD1103,AngelMD1103,True,2024-11-04 20:52:35+00:00,False,🚨 BLM leader Mark Fisher shocks followers by declaring support for Donald Trump! What will this mean for the movement? Stay tuned for updates! #BLM #DonaldTrump 🤯🗳️ https://nypost.com/video/blm-leader-mark-fisher-is-voting-for-donald-trump/,1853540873176314051,https://x.com/AngelMD1103/status/1853540873176314051,2,55,56,1395,0,,False,,,,,en,Top
"""\""Donald Trump\"""" Trump OR DonaldTrump OR DJT OR MAGA ##DonaldTrump OR ##Trump2024 OR ##MAGA min_faves:0","https://x.com/search?q=""\""Donald Trump\"""" Trump OR DonaldTrump OR DJT OR MAGA ##DonaldTrump OR ##Trump2024 OR ##MAGA min_faves:0 lang:en until:2024-11-05 since:2024-11-04&src=typed_query",Gulf Times,https://x.com/GulfTimes_QATAR,GulfTimes_QATAR,True,2024-11-04 20:19:41+00:00,False,A presidential election unlike any other in US history entered its last full day Monday with Donald Trump and Kamala Harris scrambling for an edge in a contest each portrays as an existential moment for America. #USElection2024 #USPresidentialElection2024 #Trump2024 #KamalaHarris2024 https://www.gulf-times.com/article/693914/qatar/us-polls-tuesday-trump-harris-vie-for-top-job,1853532590658998726,https://x.com/GulfTimes_QATAR/status/1853532590658998726,1,0,0,359,0,https://pbs.twimg.com/media/GbkSCjRW8AA0KY1.png;https://pbs.twimg.com/media/GbkSD7NXEAA9J_-.png,False,,,,,en,Top
"""\""Donald Trump\"""" Trump OR DonaldTrump OR DJT OR MAGA ##DonaldTrump OR ##Trump2024 OR ##MAGA min_faves:0","https://x.com/search?q=""\""Donald Trump\"""" Trump OR DonaldTrump OR DJT OR MAGA ##DonaldTrump OR ##Trump2024 OR ##MAGA min_faves:0 lang:en until:2024-11-05 since:2024-11-04&src=typed_query",Comfortably Glum,https://x.com/FeloniousJTrump,FeloniousJTrump,False,2024-11-04 21:13:23+00:00,False,"Never been prouder of a political campaign than Trump 2024. Trump is a force of nature, his enemies will soon be forgotten, Donald J Trump will be remembered for a thousand years. Elon Musk, JD Vance, RFK Jr, Tulsi Gabbard, Vivek Ramaswamy we thank you all! #Trump #MAGA",1853546105482481892,https://x.com/FeloniousJTrump/status/1853546105482481892,0,0,0,42,0,https://pbs.twimg.com/media/GbkeNrAXsAAVgqh.jpg,False,,,,,en,Top
"""\""Donald Trump\"""" Trump OR DonaldTrump OR DJT OR MAGA ##DonaldTrump OR ##Trump2024 OR ##MAGA min_faves:0","https://x.com/search?q=""\""Donald Trump\"""" Trump OR DonaldTrump OR DJT OR MAGA ##DonaldTrump OR ##Trump2024 OR ##MAGA min_faves:0 lang:en until:2024-11-05 since:2024-11-04&src=typed_query",FactCheck.org,https://x.com/factcheckdotorg,factcheckdotorg,True,2024-11-04 18:15:55+00:00,False,Donald Trump’s Closing Arguments: Energy Full story here: https://www.factcheck.org/2024/10/donald-trumps-closing-arguments/ #KamalaHarris #DonaldTrump #Election2024 #factcheck,1853501443128656358,https://x.com/factcheckdotorg/status/1853501443128656358,1,1,3,2950,0,https://pbs.twimg.com/media/Gbj1or8WAAAmNuq.jpg,False,,,,,en,Top
"""\""Donald Trump\"""" Trump OR DonaldTrump OR DJT OR MAGA ##DonaldTrump OR ##Trump2024 OR ##MAGA min_faves:0","https://x.com/search?q=""\""Donald Trump\"""" Trump OR DonaldTrump OR DJT OR MAGA ##DonaldTrump OR ##Trump2024 OR ##MAGA min_faves:0 lang:en until:2024-11-05 since:2024-11-04&src=typed_query",Alex Sanglez,https://x.com/realalexsanglez,realalexsanglez,False,2024-11-04 21:01:42+00:00,False,"Today my school held a Mock Election, and I proudly cast my vote for Donald Trump! #MAGA #Trump2024",1853543167146041817,https://x.com/realalexsanglez/status/1853543167146041817,1,0,2,175,0,https://pbs.twimg.com/media/Gbkbr9WWgAEoGIN.jpg,False,,,,,en,Top
"""\""Donald Trump\"""" Trump OR DonaldTrump OR DJT OR MAGA ##DonaldTrump OR ##Trump2024 OR ##MAGA min_faves:0","https://x.com/search?q=""\""Donald Trump\"""" Trump OR DonaldTrump OR DJT OR MAGA ##DonaldTrump OR ##Trump2024 OR ##MAGA min_faves:0 lang:en until:2024-11-05 since:2024-11-04&src=typed_query",Alberto Betancor,https://x.com/BetancorAlberto,BetancorAlberto,False,2024-11-04 22:34:21+00:00,False,#US election projections give a clear advantage to Donald Trump. #Trump2024 #trump #TrumpVance2024,1853566480194965704,https://x.com/BetancorAlberto/status/1853566480194965704,0,11,32,1535,0,https://pbs.twimg.com/media/Gbkw5CVXYAAbhBN.jpg,False,,,,,en,Top
"""\""Donald Trump\"""" Trump OR DonaldTrump OR DJT OR MAGA ##DonaldTrump OR ##Trump2024 OR ##MAGA min_faves:0","https://x.com/search?q=""\""Donald Trump\"""" Trump OR DonaldTrump OR DJT OR MAGA ##DonaldTrump OR ##Trump2024 OR ##MAGA min_faves:0 lang:en until:2024-11-05 since:2024-11-04&src=typed_query",Alberto Betancor,https://x.com/BetancorAlberto,BetancorAlberto,False,2024-11-04 20:51:59+00:00,False,Why Donald Trump is going to win: 1) He was a good President. 2) He is the resurgence of the West. 3) He is a guarantee for world peace. #Trump2024 #TrumpVance2024,1853540719035588680,https://x.com/BetancorAlberto/status/1853540719035588680,1,5,9,4629,0,https://pbs.twimg.com/media/GbkZdiAWcAAP6YE.jpg,False,,,,,en,Top
"""\""Donald Trump\"""" Trump OR DonaldTrump OR DJT OR MAGA ##DonaldTrump OR ##Trump2024 OR ##MAGA min_faves:0","https://x.com/search?q=""\""Donald Trump\"""" Trump OR DonaldTrump OR DJT OR MAGA ##DonaldTrump OR ##Trump2024 OR ##MAGA min_faves:0 lang:en until:2024-11-05 since:2024-11-04&src=typed_query",CharismaMag,https://x.com/charismamag,charismamag,False,2024-11-04 21:34:57+00:00,False,California Pastor Ché Ahn believes Donald Trump is a changed man spiritually as a result of surviving the July assassination attempt. Read Now: https://zurl.co/RGrj @che_ahn #DonaldTrump #faith #life #calling #prayer,1853551533104984305,https://x.com/charismamag/status/1853551533104984305,0,1,1,167,0,https://pbs.twimg.com/media/GbkjS_fbsAA4u5p.jpg,False,,,,,en,Top
"""\""Donald Trump\"""" Trump OR DonaldTrump OR DJT OR MAGA ##DonaldTrump OR ##Trump2024 OR ##MAGA min_faves:0","https://x.com/search?q=""\""Donald Trump\"""" Trump OR DonaldTrump OR DJT OR MAGA ##DonaldTrump OR ##Trump2024 OR ##MAGA min_faves:0 lang:en until:2024-11-05 since:2024-11-04&src=typed_query",𝗪𝗜𝗧𝗖𝗛𝗢𝗟𝗟𝗢 🇪🇸,https://x.com/mitchollo,mitchollo,False,2024-11-04 19:45:14+00:00,False,sorry woman but we ain't voting for you. me and my niggas are voting mr. donald j. trump for president. #maga #trump2024,1853523921728848265,https://x.com/mitchollo/status/1853523921728848265,10,5,21,2502,0,,False,,,,,en,Top
"""\""Donald Trump\"""" Trump OR DonaldTrump OR DJT OR MAGA ##DonaldTrump OR ##Trump2024 OR ##MAGA min_faves:0","https://x.com/search?q=""\""Donald Trump\"""" Trump OR DonaldTrump OR DJT OR MAGA ##DonaldTrump OR ##Trump2024 OR ##MAGA min_faves:0 lang:en until:2024-11-05 since:2024-11-04&src=typed_query",🌟RowdyRedstick 💫✨,https://x.com/BatonRouge_1,BatonRouge_1,False,2024-11-04 21:18:30+00:00,False,"President Reagan..I got great news sir. That ""somebody"" is Donald J Trump. #MAGA #TRUMP2024ToSaveAmerica",1853547392991207563,https://x.com/BatonRouge_1/status/1853547392991207563,2,1,13,218,0,https://pbs.twimg.com/media/Gbkfh_OXUAA3EGO.jpg,False,,,,,en,Top
"""\""Donald Trump\"""" Trump OR DonaldTrump OR DJT OR MAGA ##DonaldTrump OR ##Trump2024 OR ##MAGA min_faves:0","https://x.com/search?q=""\""Donald Trump\"""" Trump OR DonaldTrump OR DJT OR MAGA ##DonaldTrump OR ##Trump2024 OR ##MAGA min_faves:0 lang:en until:2024-11-05 since:2024-11-04&src=typed_query",Jonathan Cowap,https://x.com/joncowap,joncowap,False,2024-11-04 20:46:21+00:00,False,Donald Trump or Kamala Harris? If you had a vote in the #USAElections who would you vote for? And why? A survey says 68% of Brits would support #KamalaHarris and 32% would vote for #DonaldTrump. Does that reflect your feelings? Thoughts please⬇️,1853539302837490135,https://x.com/joncowap/status/1853539302837490135,0,0,1,212,0,https://pbs.twimg.com/media/GbkYK2gWIAAedIW.jpg,False,,,,,en,Top
"""\""Donald Trump\"""" Trump OR DonaldTrump OR DJT OR MAGA ##DonaldTrump OR ##Trump2024 OR ##MAGA min_faves:0","https://x.com/search?q=""\""Donald Trump\"""" Trump OR DonaldTrump OR DJT OR MAGA ##DonaldTrump OR ##Trump2024 OR ##MAGA min_faves:0 lang:en until:2024-11-05 since:2024-11-04&src=typed_query",🌊 Leftover News 🌊,https://x.com/LeftoverNews,LeftoverNews,False,2024-11-04 22:43:04+00:00,False,"While generosity is when the rich give to the poor and gullibility is when the poor give to the rich, Donald Trump hopes the gullible vote for him so he can take from the poor to be generous with the rich. @RealDonaldTrump wants #MAGA to be #MakeAmericaGullibleAgain",1853568675812704575,https://x.com/LeftoverNews/status/1853568675812704575,0,2,3,2900,0,https://pbs.twimg.com/media/Gbky0PZbUAAOU4i.jpg,False,,,,,en,Top
"""\""Donald Trump\"""" Trump OR DonaldTrump OR DJT OR MAGA ##DonaldTrump OR ##Trump2024 OR ##MAGA min_faves:0","https://x.com/search?q=""\""Donald Trump\"""" Trump OR DonaldTrump OR DJT OR MAGA ##DonaldTrump OR ##Trump2024 OR ##MAGA min_faves:0 lang:en until:2024-11-05 since:2024-11-04&src=typed_query",🌸🌿♕️Janelle♕️🌿🌸💗𓆏,https://x.com/JanieGirlTX,JanieGirlTX,True,2024-11-04 21:49:49+00:00,False,"🇺🇲""Coming Soon! The Golden Age of America!"" ~ Donald J. Trump🇺🇲 #MAGA🇺🇲 #Trump2024🇺🇲",1853555276072489386,https://x.com/JanieGirlTX/status/1853555276072489386,0,0,1,51,0,https://pbs.twimg.com/media/GbkmVwjWMAAxSEH.jpg,False,,,,,en,Top
